http://redalertpolitics.com/,MIXED,Right Bias,Red Alert Politics states that it is an online publication written by young conservatives for young conservatives. It is published by MediaDC; which also publishes The Weekly Standard and The Washington Examiner. This source has a right wing bias in reporting and wording. It is average for sourcing and is moderately trustworthy for accuracy of information.(12/8/2016)
http://www.redflagnews.com/,MIXED,Right Bias,Red Flag News is a news and opinion website that reports with far right wing bias. Although they do publish real news; many stories are not properly sourced or are simply conspiracy theories. Has a questionablefact checking record.
http://www.redstate.com/,MIXED,Right Bias,Red State is a news opinion blog run by Erick Erickson; a TV and radio commentator.The information on the blog has loaded language and is right biased based on story selection. Erick Erickson does not have a great track record with fact checkers.
http://redstatewatcher.com/,HIGH,Right Bias,Red State Watcher is a conservative news website that has strong right wing bias in reporting choices. While Red State Watcher does source its stories they almost always favor the right and discredit the left. In other words it is one sided. So; while this website might have a strong right wing bias; they are actually sourcing to mostly mainstream sources and hence we can give a high factual rating; but it must be navigated though a lot of bias.
https://regated.com/,MIXED,Right Bias,Regated news is a news and opinion website with a right wing bias in reporting. Sometimes publishes poorly sourced news.
http://www.resistancemedia.org/,MIXED,Right Bias,Resistance Media is a news and opinion website that focuses on public school reform; government transparency and family rights. The writerschoose to remain anonymousso they are automatically discredited as a legitimate source. Resistance Media is a far right biased news source that advocates for right wing political objectives such as limited immigration and anti-LGBTQ legislation. Some information is sourced well while others are sourced to highly questionable sources such as The Federation for American Immigration Reform (FAIR); which according to the Southern Poverty Law Center has ties to white supremacists. We would also like to point out that this source considers the SPLC as a corrupt liberal organization against white people. Another interesting aspect of this website is the FAQ page. Amazingly; two frequently asked questions are: Are you a racist? and Why do you hate gay people? One has to wonder why people are frequently asking those questions. Based on borderline extreme bias and using sources that are questionable we rate them mixed for factual reporting.
http://www.ronpaullibertyreport.com/,MIXED,Right Bias,The Ron Paul Liberty Reportis a website and video programcreated by former Republican (Libertarian)Congressman Ron Paul. The LibertyReport advocates for a non-interventionist foreign policy and the protection of civil liberties at home. The Liberty Report generally reports with minimal loaded words and most times sources to credible information. However; there are times that they source to far right; questionable or conspiracy websites. They also occasionally publish unsubstantiated claims such as the Syria chemical attack being a false flag operation. (5/4/2017)
http://www.secureamericanow.org/,MIXED,Right Bias,Secure America Now (SAN) is a politically conservative nonprofit group that focuses on United States foreign policy issues. It says its mission is to raise security issues to the forefront of the American debate (Wikpedia). Has a blog section that presents news with a right wingpolitical bias and has a mostly false rating according to Politifact.
http://silenceisconsent.net/,MIXED,Right Bias,Silence is Consent is a right wing news and opinion website.This sources uses strong loaded words and typically only publishes one side of the story. While there is certainly effort to source information in the articles; they sometimes source to far right or questionable sources according to our ratings.
http://spiked-online.com/,MIXED,Right Bias,Spiked is a British Internet magazine focusing on politics; culture and society from a libertarian viewpoint.Spiked focuses on issues of freedom and state control; science and technology; culture; education and literature. Has a moderate right wing bias in reporting and does not support the consensus of science on environmental issues.(12/27/2016)
http://www.westernjournalism.com/thepoint/,MIXED,Right Bias,Tea Party News is now called The Point and is hosted by Western Journalism.The website still has farright wing biased contentthat utilizes strong loaded words against liberalism. Does not shy from conspiracy theories such as Hillary Clinton having Parkinsons Disease. (7/19/2016) Updated (4/6/2017)
http://www.teapartypatriots.org/,HIGH,Right Bias,Tea Party Patriots is a conservative American political organization that promotes fiscally responsible activism as part of the Tea Party movement. The Tea Party Patriots website provides news related to the Tea Party and conservative/libertarian politics. Articles have minimal loaded words and most are well sourced and factually based.
http://www.teapartytribune.com/,HIGH,Right Bias,The Tea Party Tribune is news and opinion site that has a right wing bias in reporting choices. TPT primary covers conservative politics that is in line with the Tea Party platform. While many articles certainly have a strong right wing bias in word selection; most are reasonably sourced to credible websites and information. (7/19/2016)
http://www.theamericancause.org/,MIXED,Right Bias,The American Cause is an educational organization whose mission is to advance and promote traditional American values that are rooted in the conservative principles of national sovereignty; economic patriotism; limited government; and individual freedom.
http://theblacksphere.net/,MIXED,Right Bias,According the About Page on this websiteThe Black Sphere team wants to End Identity Politics; educating with satire and humor. The site content consists of a far right wing bias and does focus heavily on racism. Keep in mind this is the right wing take on racism. Has a questionable fact check. (10/15/2016)
http://www.theblaze.com/,MIXED,Right Bias,TheBlaze is a multiplatform news and entertainment network available on television; radio and the Internet founded by conservative talk radio personality and entrepreneur Glenn Beck. TheBlaze has a conservative bias in reporting. Some news stories and television personalities are not always factually accurate. (7/19/2016)
http://www.thecollegefix.com/,MIXED,Right Bias,The College Fix is a conservative news blog run bythe Student Free Press Association which is a nonprofit organization run by veteran journalists to help beginning journalists. The veteran journalists in this case are all conservatives. The College Fix typically writes about higher education news; but also covers politics with a right wing bias in reporting. There is moderate use of loaded words and they have failed some facts checks here and here.
http://www.dailytelegraph.com.au/,MIXED,Right Bias,The Daily Telegraph is a conservative; Australian tabloid newspaperpublished in Sydney; New South Wales; by Nationwide News; part of News Corp. Known as Australias least trusted newspaper. (8/14/2016)
http://www.dailywire.com/,MIXED,Right Bias,The Daily Wire is a politically conservative American news and opinion website founded in 2015 by conservative political commentator Ben Shapiro; who currently serves as Editor-in-chief. Presents news with a right wing bias in reporting and wording. The Daily Wire has also published false information such as thisand this from Ben Shapiro. (9/2/2016) Updated (5/30/2017)
http://thefederalist.com/,HIGH,Right Bias,The Federalist is an English-language online magazine that covers politics; policy; culture; and religion.The Federalist has been described as influential in conservative and libertarian circles. Has a right wing bias in reporting; but is usually well sourced. (8/8/2016)
http://www.thenewamerican.com/,MIXED,Right Bias,The New American (TNA) is a print magazine published twice a month by American Opinion Publishing Inc.; a wholly owned subsidiary of the John Birch Society. Displays right wing bias in reporting and does not always follow the consensus of science. (7/19/2016) Updated (4/6/2017)
https://patriotpost.us/,MIXED,Right Bias,The Patriot Post is a Conservative media source promoting individual liberty. It has a right wing bias in reporting andstory choices. The Patriot Post writes its own stories that are often opinion pieces; andthey are usually well sourced. They also aggregate content from other sources that come from mostly credible sources. Does not always support the consensus of science. (7/19/2016) Updated (4/23/2017)
http://www.thepostemail.com/,MIXED,Right Bias,The Post and Email is an online newspaper that is overtly Christian and conservative in bias.
https://therealstrategy.com/,MIXED,Right Bias,The Real Strategy is an online news source with a moderate to strong right wing bias. The source uses sensational headlines to attract readers and some stories have been questionable factually.
http://www.therebel.media/,MIXED,Right Bias,The Rebel Media (or The Rebel) is a conservative Canadian online political and social commentary media platform founded in February 2015 by former Sun News Network host Ezra Levant. Overt right wing bias. Tends to source to other articles on The Rebel website rather than outside sources.
http://therightscoop.com/,HIGH,Right Bias,The Right Scoop demonstrates aright wing bias in reporting choices and somewhat in wording of headlines. The Right Scoop is very similar to Fox News in their bias and approach. The difference between the two is we could not find any failed fact checks for The Right Scoop; though some headlines were misleading. (8/15/2016) Updated (4/6/2017)
http://www.ronpaulinstitute.org/,MIXED,Right Bias,The Ron Paul Institute for Peace and Prosperity is a project of the foundation; named for Congressman Ron Paul. The institute advocates for a non-interventionist foreign policy and the protection of civil liberties at home. The Ron Paul Institute generally reports with minimal loaded words and most times sources to credible information. However; there are times that they source to far right; questionable or conspiracy websites. They also occasionally publish unsubstantiated claims such as the Syria chemical attack being a false flag operation. (5/3/2017)
https://www.thesun.co.uk/,MIXED,Right Bias,The Sun is a daily tabloid newspaper published in the United Kingdom and Ireland. As a broadsheet; it was founded in 1964 as a successor to the Daily Herald; it became a tabloid in 1969 after it was purchased by its current owners. It is published by the News Group Newspapers division of News UK; itself a wholly owned subsidiary of Rupert Murdochs News Corp. Bottom line is this tabloid reports trashy ridiculous stories with a right wing bias.
http://www.torontosun.com/,HIGH,Right Bias,The Toronto Sun is an English-language daily tabloid newspaper published in Toronto; Ontario; Canada. It is known for its daily Sunshine Girl feature and its populist conservative editorial stance. Uses sensational right wing headlines; but is usually sourced.
http://townhall.com/,HIGH,Right Bias,Townhall is an American politically conservative website and print magazine. Previously published by the Heritage Foundation.The website also publishes news articles from the Associated Press. Townhall has a right wing bias through story selection and sensational wording of headlines. However; they do tend to source their news content well. Opinion pieces have a very strong right wing bias.
http://tribunist.com/,MIXED,Right Bias,The Tribunist is a right biased online source that uses loaded words and somewhat misleading headlines. They also have a mostly false claim.
http://truthinmedia.com/,MIXED,Right Bias,Truth In Media attempts to fact check controversial topics. While some of the investigations are legitimate some are not. This source also supports pseudoscience in some cases. (7/19/2016)
http://twitchy.com/,MIXED,Right Bias,Twitchy is an American Twitter curation and news website founded by conservative commentator Michelle Malkin in 2012. Has a right wing bias in reporting choices and often uses sensational clickbait headlines. This is a borderline questionable source for far right bias and some propaganda. (10/2/2016) Updated (7/7/2017)
http://www.unbiasedamerica.com/,MIXED,Right Bias,Unbiased America is a news and opinion blog with a moderate right wing bias. Unbiased Americas writers use moderate loaded words in both headlines and in the body of articles. Their stories also slightly favor conservatives and are against liberals. They do attempt to source to credible information; but at times source to other right wing biased sources.
https://uspoliticsinfo.com/,MIXED,Right Bias,US Politics Info is a news and opinion website with right wing bias in reporting and story selection. Often uses sensational; charged headlines and does not always source to credible information or at all in some cases such as this.
http://www.usapoliticstoday.com/,MIXED,Right Bias,USA Politics Today is a right wing news and opinion website. This source has strong right wing bias in story selection and uses loaded words in headlines and articles. This source also sometimes sources to other right wing sources and has had a false claim with fact checking.
http://vesselnews.io/,MIXED,Right Bias,From the Vessel News about page: Vessel News is a different kind of news destination; redefining the right-wing media narrative by combining Americas most transformative phenomenonsanti-establishment conservative politics and technological innovation. Vessel News is a lighting bolt for exposing the leftist agenda; who seek to steal our freedom of speech; right to bear arms and refuse to call by name the enemies of our way of lifeRadical. Islamic. Terrorists.
http://www.vivaliberty.com/,MIXED,Right Bias,VivaLiberty is a news and opinion blog/website with a right wing bias in reporting choices. Most articles are snippets from other news agencies that then link to the full story. In our review we found that VivaLiberty sources to a variety of sources; with most from the right such as Newsbusters; which is not always a factual source. The common theme of all articles on this website is that they are pro-conservative and anti-liberal. For example; a quick scan of articles from their political category reveal about half to be anti-Clinton and this is 7 months after she lost the election. Overall; this site has a strong right wing bias and does source properly. However; due to sourcing to far right sources that are not always factual we give VivaLiberty a mixed factual rating. Further; we could not find information on who owns and runs this website.
http://freebeacon.com/,MIXED,Right Bias,The Washington Free Beacon is an American politically conservative political journalism website that publishes news and opinion commentary. It has a very strong right wing bias and often publishes misleading headlines that do not match the content of stories. Has published a completely fake story. (7/19/2016) Updated (6/23/2017)
http://www.weaselzippers.us/,MIXED,Right Bias,Weasel Zippers is your basic right wing news blog. Has pretty typical bias at the more extreme end of right.Sometimes sources to far right or questionable sources. Has a mostly false claim with Politifact.
http://www.weeklystandard.com/,HIGH,Right Bias,The Weekly Standard is an American neoconservativeopinion magazinepublished 48 times per year. Its founding publisher; News Corporation; debuted the title on September 18; 1995. It has a strong right wing editorial bias; but reports news stories with strongsourcing. (7/19/2016)
http://www.westernjournalism.com/,MIXED,Right Bias,The Western Journalism Center was founded in 1991 by Joseph Farah and James H. Smith. Based in Sacramento; California; the center produces a popular conservative newsletter. Western Journalism produces right wing biased stories and sensational content. (10/15/2016)
http://www.wnd.com/,MIXED,Right Bias,Based on reviews by all of our researchers; WND is an online news source that has a far right bias and dabbles in right wing conspiracies such as President Obamas birth certificate. They also use misleading clickbait headlines that do not always match the content of the article (See M. Allens review below). WND also hasa mixedtrack record with fact checkers: here and here(D. Van Zandt 6/19/2016). Below is the detailed reviews of each researcher.
https://world.wng.org/,MIXED,Right Bias,World is a biweeklyChristian news magazine; published in the United States by Gods World Publications; a non-profit 501(c)(3) organization based in Asheville; North Carolina. Worlds declared perspective is one of Christian evangelical Protestantism. Our review of World reveals a source that tends to report news factually; however there is significant political bias based on their christian perspective. Ie. Against abortion; LGBTQrights and even evolution. If not for generally solid news reporting; we would have rated World in our pseudoscience category. Based on their promotion of pseudoscience such as Intelligent Design; we rate WorldMixed for factual reporting and right biased politically.
http://worldtribune.com/,HIGH,Right Bias,World Tribune is an American news outlet that focuses on international news and geopolitics. The World Tribune is generally factual in reporting and sources to mostly credible media outlets. When it comes to story choices most favor conservatives and are negative toward the left. They do use loaded language to convey positive or negative emotion in articles and headlines. Overall; we did not find any failed fact checks and this source is pro-conservative. (4/29/2017)
http://yellowhammernews.com/,HIGH,Right Bias,Yellowhammer News is a conservative news site covering politics and culture in the state of Alabama. The site was founded in 2011. The website produces quality journalism with a moderate right wing bias.
http://www.youngcons.com/,MIXED,Right Bias,Young or old; they publish the same old far right biased stories and conspiracies. They use extreme loaded words and sometimessource to questionable information.
http://www.airspacemag.com/,VERYHIGH,Pro-Science,Air & Space/Smithsonian magazine is a bimonthly magazine put out by the National Air and Space Museum. (12/2/2016)
https://www.aap.org/,VERYHIGH,Pro-Science,The American Academy of Pediatrics (AAP) is an American professional association of pediatricians; headquartered in Elk Grove Village; Illinois; and maintains its Department of Federal Affairs office in Washington; D.C. The AAP News is the academys official newsmagazine;and Pediatrics is its flagship journal. (4/15/2017)
http://www.aaas.org/,VERYHIGH,Pro-Science,The American Association for the Advancement of Science (AAAS) is an American international non-profit organization with the stated goals of promoting cooperation among scientists; defending scientific freedom; encouraging scientific responsibility; and supporting scientific education and science outreach for the betterment of all humanity.It is the worlds largest general scientific society; with over 120;000 members;and is the publisher of the well-known scientific journal Science. (10/5/2016)
https://www.aip.org/,VERYHIGH,Pro-Science,The American Institute of Physics (AIP) promotes science; the profession of physics; publishes physics journals; and produces publications for scientific and engineering societies. The AIP is made up of various member societies. Its corporate headquarters are at the American Center for Physics in College Park; Maryland; but the institute also has offices in Melville; New York and Beijing.
http://www.ajaonline.org/,VERYHIGH,Pro-Science,The American Journal of Archaeology (AJA); the peer-reviewed journal of the Archaeological Institute of America; has been published since 1897. (12/2/2016)
http://www.americanscientist.org/,VERYHIGH,Pro-Science,American Scientist (informally abbreviated AmSci) is an American bimonthly science and technology magazine published since 1913 by Sigma Xi; The Scientific Research Society. Each issue includes four to five feature articles written by prominent scientists and engineers who review research in fields from molecular biology to computer engineering. (4/15/2017)
https://www.adaa.org/,VERYHIGH,Pro-Science,The Anxiety and Depression Association of America (ADAA) is a U.S. nonprofit organization dedicated to increasing awareness and improving the diagnosis; treatment; and cure of anxiety disorders in children and adults.The Anxiety and Depression Association of America (ADAA) is involved in education; training; and research for anxiety and stress-related disorders. The mission statement of the Anxiety and Depression Association of America (ADAA) is to promote the prevention; treatment; and cure of anxiety; depression; and stress-related disorders through education; practice; and research. (5/23/2017)
http://www.archaeology.org/,VERYHIGH,Pro-Science,Archaeology Magazine is a bimonthly mainstream publication for the general public; supported by its website archaeology.org. The magazine is published by the Archaeological Institute of America. The institute also publishes the professional American Journal of Archaeology. (12/2/2016)
http://arstechnica.com/,HIGH,Pro-Science,Ars Technicais a technology news and informationwebsite. It publishes news; reviews; and guides on issues such as computer hardware and software; science; technology policy; and video games. Many of the sites writers are postgraduates and some work for research institutions. Articles on the website are written in a less-formal tone than those in traditional journals. (8/26/2016)
http://www.skeptics.com.au/,HIGH,Pro-Science,Australian Skeptics is a loose confederation of groups across Australia that investigate paranormal and pseudo-scientific claims from a responsible scientific viewpoint. (1/19/2017)
http://autisticadvocacy.org/,VERY HIGH,Pro-Science,The Autistic Self Advocacy Network (ASAN) is a 501(c)(3) nonprofit advocacy organization run by and for individuals on the autism spectrum. ASAN holds that the goal of autism advocacy should be a world in which Autistic people enjoy the same access; rights; and opportunities as all other people; and that Autistic voices should be included in any public discourse on autism; whether in public policy; mass media; or other venues. ASAN is based in Washington; D.C. All information regarding autism is science based. (3/17/2017)
http://climateactiontracker.org/,VERYHIGH,Pro-Science,Climate Action Tracker is an independent science-based assessment; which tracks the emission commitments and actions of countries. The website provides an up-to-date assessment of individual national pledges to reduce their greenhouse gas emissions. They have a well sourced Methodology. (12/23/2016) Updated (3/17/2017)
http://www.climatecentral.org/,VERYHIGH,Pro-Science,Climate Central surveys and conducts scientific research on climate change and informs the public of key findings.Climate Central is a qualified 501(c)3 tax-exempt organization. While this source is evidence based; they do have a leftward political bias through criticism of Republican policy. (3/17/2017)
http://climatefeedback.org/,VERYHIGH,Pro-Science,Climate Feedbackdistinguishes inaccurate climate change narratives from scientifically sound and trustworthy information in the media. They also provide feedback to editors about the credibility of information published in their outlets.Each reviewerholds a Ph.D. and has recently published articles in top-tier peer-reviewed science journals. In a nutshell this is a climate science fact checking website that provides solid information. (3/6/2017)
https://www.cnet.com/,HIGH,Pro-Science,CNET is about as pro science and technology as you can get. While their forte is the massive library of free and pay software and apps available for download; theres a lot more to CNET as well. They report on the science news; new technology; consumer electronics; cars; and smart home gadgets; and produce tech related videos and podcasts as well. Theres also an extensive how-to section for getting the most out of your electronics; and a deals section for finding the best stuff at the best price. The news and reviews are all solidly sourced and factual. (D. Kelley 2/23/2017)
http://www.csicop.org/,VERYHIGH,Pro-Science,The Committee for Skeptical Inquiry (CSI); is a program within the transnational American non-profit educational organization Center for Inquiry (CFI); which seeks to promote scientific inquiry; critical investigation; and the use of reason in examining controversial and extraordinary claims. (12/2/2016)
http://contrailscience.com/,VERYHIGH,Pro-Science,Contrail Science is a website that explains contrails and debunks the chemtrail conspiracy/pseudoscience theories through the use of evidence. (2/14/2017)
http://discovermagazine.com/,HIGH,Pro-Science,Discover is an American general audience science magazine launched in October 1980 by Time Inc. It has been owned by Kalmbach Publishing since 2010. Focuses more on light science; but is always factual and evidence based. (12/2/2016)
http://doubtfulnews.com/,VERYHIGH,Pro-Science,Doubtful News is a privately-owned; science and evidence based site by Lithospherica; LLC. Theyhelp theiraudiencesee beyond the news headlines and fantastic anecdotes. Is well sourced and scientific in approach. (1/31/2017)
