http://politicalupdater.com/,MIXED,Left Bias,Political Updater is a news and opinion website that reports with loaded words and not always well sourced information. While the site does seem to report both left and right stories there ismore that favor the left in our sampling. (8/15/2016)
http://www.politicususa.com/,HIGH,Left Bias,PoliticusUsa is a left wing biased news and opinion website. PoliticusUsa typically sources to credible media sourcessuch as Reutersandare factual in reporting as we were unable to find any instances of failed fact checks. Though headlines tend to be somewhat sensational; the content of articles is evidence based with occasional use of loaded words that convey emotion. In short; PoliticusUsa is left biased through story choicesand wording; but factual in reporting. (5/15/2016)
http://www.pravdareport.com/,MIXED,Left Bias,Pravda Reports is a far left communist newspaper from Russia. It does not always report accurately about USA and other international news. (7/30/2016)
https://www.pressprogress.ca/,HIGH,Left Bias,Press Progress; an online news and analysis website; is a project of the Broadbent Institute which seeks to provide an online Progressive Political news source. Press Progress has a left bias in reporting stories and uses moderately loaded word choices. They do however; link to mostly credible sources. (2/18/2017)
http://proudemocrat.com/,MIXED,Left Bias,I am pretty sure you have gathered the bias by the name alone. There is a very strong left wing bias here. They occasionally produce good content; butthey also fail to source sometimes to quality sources.
http://rabble.ca/,HIGH,Left Bias,Rabble.ca is an non-profit alternative Canadian online magazine founded in 2001.Rabble.ca works in partnership with the Canadian Centre for Policy Alternatives and the Centre for Social Justice. It features podcasts; videos and an discussion board called babble. Rabble uses a lot of loaded language in the headlines; and within the articles. Mostly in commentaries they describe themselves as blurring the line between readers and contributors; providing a space for issues exploring political passions and an opportunity to expand ideas. They are an openly progressive site; reporting and commenting on current news with a clear left bias. (F. Locke Siewert 2/11/2017)
http://www.rappler.com/,MIXED,Left Bias,Rappler is an online news site based in the Philippines with a bureau in Jakarta; Indonesia.One of the distinguishing features of Rappler is its Mood Meter consisting of bubbles showing the way people react to certain news.The Mood Meter is embedded on each story. Users are asked how does this story make you feel? and are given 8 different emotions to choose from  happy; sad; angry; afraid; annoyed; inspired; amused and dont care. The top ten stories with the most votes over a 48-hour period appear on the Mood Navigator. Rappler has left wing bias in reporting news from the Philippines. They are fiercely opposed to President Duterte and his anti-drug campaign where he advocates killingdrug users. We give a mixed factual reporting rating based on some disputes regarding claims made by Rappler. When reporting international news Rappler is relatively low biased and straightforward. (5/16/2017)
http://www.rawprogressive.com/,MIXED,Left Bias,Raw Progressiveis a news and opinion website with a borderline extreme left bias in reporting. Virtually every headline utilizes sensational loaded words that induce clicking (Clickbait). The content of articles; are typically sourced to far left sources such as LeftScoop. Raw Progressive typically takes a news story and interjects left biased opinions around the story.The opinion is always pro-left and anti-right. Although we could notfind any instances of failed fact checks; we still rate them mixed for factual reporting based on strong opinions that can be distracting and misleading from the facts. This source also does not have an About page or any other author information; which reduces credibility.
http://www.rawstory.com/,MIXED,Left Bias,The Raw Story is an American online news organization founded in 2004 by John Byrne. It covers current national and international political and economic news and publishes its own editorials and investigative pieces. The Raw Story describes itself as progressive; bringing attention to stories that it sees as downplayed or ignored by other media outlets. Raw Story demonstrates left wing bias in reporting and story selection.Raw Story has a Half-True claim with Politifact and an Unproven claim with Snopes. (5/15/2016)
http://www.redpepper.org.uk/,HIGH,Left Bias,Red Pepper is an independent radical red and green magazine based in the UK. Has strong socialist biases; but is well sourced.
https://rewire.news/,HIGH,Left Bias,Rewire is a website focused on reproductive and sexual health from a pro-reproductive rights perspective.The website began as a UN Foundation blog in 2006; and became its own nonprofit organization in January 2012. Although the site has a left wing political perspective it does offer mostly evidence based information. (10/17/2016)
http://revcom.us/,MIXED,Left Bias,Revcom.us is the voice of the Revolutionary Communist Party of the USA. With that said is has a strong Communist bias. It uses strong loaded words to describe other political parties. The sole purpose of the site is to promote Communism.
http://revolution-news.com/,HIGH,Left Bias,Revolution News is a news and opinion website featuring independent journalists. Published stories typically have a moderate left wing bias and are usually sourced properly.
http://www.rightwingwatch.org/,MIXED,Left Bias,Right Wing Watch keeps track of a variety of organizations; but the groups they track do tend to be conservative extremist in one regard or another. This source does occasionally take statements out of context. Needs to be fact checked. (5/15/2016)
https://trofire.com/,HIGH,Left Bias,Ring of Fire is a nationally syndicated American talk radio program that has Overt left wing bias. Each host has their own style and level of bias; but most source reliable sources in their reporting. They do however; take many things out of context.
http://www.salon.com/,HIGH,Left Bias,Salon is a progressive/liberal website created by David Talbot in 1995 and part of Salon Media Group. It focuses on U.S. politics and current affairs. Salon hashas left wing bias through reporting and wording; but can be trusted to source to mostly credible information. (5/15/2016)
http://www.scarymommy.com/,HIGH,Left Bias,Scary Mommy is a news and opinion website/blog that is geared toward parenting. They also cover news and politics with a left wing bias in reporting choices. There is minimal use of loaded words and all stories are factual and/or sourced properly.
http://shareblue.com/,MIXED,Left Bias,Shareblue is an online political news source. It is affiliated with Blue Nation Review and David Brock. This source; like Blue Nation Review has a strongleft wing bias in story selection and wording. Shareblue also occasionally publishes stories that are propagandist and misleading factually.
http://www.slate.com/,HIGH,Left Bias,Slate is an English-language online current affairs; politics and culture magazine in the United States that trends towards a liberalviewpoint through story choices and wording. Slate tends to source to credible information; but uses rather sensationalized headlines to increase clicks. (5/15/2016) Updated (2/24/2017)
http://www.worldsocialism.org/spgb/,HIGH,Left Bias,Socialist Standard is a monthly socialist magazine published without interruption since September 1904 by the Socialist Party of Great Britain. The magazine is written in a simple; direct style and focuses mainly on socialist advocacy and Marxian analysis of current events; particularly those affecting the United Kingdom.
http://www.sourcewatch.org/index.php/SourceWatch,HIGH,Left Bias,SourceWatchaims to produce a directory of public relations firms; think tanks; industry-funded organizations and industry-friendly experts that work to influence public opinion and public policy on behalf ofcorporations; governments and special interest groups (Wikipedia). SourceWatchs reporting always tends to favor liberals. They do however; source their content and are considered factual.
https://www.stpete4peace.org/,HIGH,Left Bias,Chris Ernesto (born October 16; 1963) is a founding member of St. Pete for Peace;a non-partisan antiwar organization providing peace oriented education events and services to the Tampa Bay; FL community since 2003. He created and manages the StPeteForPeace.org; OccupyArrests.comand USinAfrica.comwebsites. Ernesto has also organized numerous demonstrations; published multiple articles and videos; and is a lead researcher for St. Pete for Peace where he has developed dozens of fact sheets. St. Pete for Peace has a left wing political bias; however; they do source well; although at times to other left wing sources. Otherwise; this is a pretty trustworthy source for anti-war information.
http://talkingpointsmemo.com/,HIGH,Left Bias,Talking Points Memo (or TPM) is a liberal web-based political journalism website created and run by Josh Marshall; a journalist; liberal bloggerand historian.It debuted on November 12; 2000.TPM has liberal bias in story selection andproduces some very credible journalism. They almost always source to credible information. (7/26/2016)
http://www.takepart.com/,HIGH,Left Bias,TakePart produces a Web site with a daily cycle of original articles; blogs; and videos on the culture and lifestyle of change. Topics of coverage include animals; arts; food; education; the environment; green tech; politics; culture; health and innovation.
http://www.telesurtv.net/english/,MIXED,Left Bias,La Nueva Televisora del Sur (teleSUR; English: The New Television Station of the South) is multi-state funded; panLatin American terrestrial and satellite television network sponsored by the governments of Venezuela; Cuba; Ecuador; Nicaragua; Uruguay; and Bolivia that is headquartered in Caracas; Venezuela. TeleSUR has been accused of being a propaganda tool forHugo Chavez and his successors. TeleSUR uses minimal loaded words; but has a very strong pro-Venezuela and anti-American bias in reporting. (1/5/2017)
http://prospect.org/,HIGH,Left Bias,The American Prospect is a quarterly American political magazine dedicated to American liberalism. Based in Washington; D.C.; The American Prospect says it aims to advance liberal and progressive goals through reporting; analysis; and debate about todays realities and tomorrows possibilities. The American Prospecthas a left wing bias in story selection and is always well sourced. (5/15/2016)
http://www.blue-route.org/blog/,MIXED,Left Bias,The Blue Route is a news and opinion website with strong left wing bias in reporting and emotional word use. They sometimes source to other far left sources and many articles are opinion based; hence we give a mixed factual rating. (7/26/2016)
http://www.thecanary.co/,HIGH,Left Bias,The Canary is a left-wing political blog in the United Kingdom. The Canary uses strong loaded words with a left-wing bias. They are evidence based and provide sources for claims. They typically report only one side of the story and have a strong liberal political affiliation. (12/1/2016)
https://www.climaterealityproject.org/,HIGH,Left Bias,The Climate Reality Project; founded by Al Goreis a non-profit organization involved in education and advocacy related to climate change. The mission of the Climate Reality Project is to focus on climate change education and countering climate change denial campaigns worldwide. While TCRP is well sourced and factual in scientific information; it also has a left wing bias in its criticism of President Trump and Conservatives.We give this organization a moderate left bias rating based on story selection that opposes the conservative point of viewthat climate change is not human caused or simply not important. (3/23/2017)
http://thedailybanter.com/,HIGH,Left Bias,The Daily Banter is an online news and opinion site. It produces well written articles that must be filtered through their liberal bias on most stories. Most information is sourced.
http://the-daily.buzz/,HIGH,Left Bias,The Daily Buzz is a multimedia and news website that covers a variety of topics; including politics. The Daily Buzz features many humorous articles; but they also present straightforward news that is well sourced and factual. News reporting tends to have a left bias in story selection and somewhat sensationalized headlines. However; the content of these news articles are often well writtenand always link to credible sources.
https://www.thedailyvox.co.za/,HIGH,Left Bias,The Daily Vox is a South African news and opinion website. They present news with slightly loaded words that have a left wing bias. Most articles are well sourced. (1/22/2017)
http://www.democratichub.com/,MIXED,Left Bias,This is perhaps the easiest review ever done. From The Democratic Hubs about page: Our online community is for liberals; progressives; moderates; independent and anyone who has a favorable opinion of Democrats and/or liberal political views or is critical of Republican ideology. That really about sums it up. This source uses strong loaded words that favor Democrats and discredits Republicans. All content is written by member bloggers and is highly opinionated; which matches their appropriate description. At least they are honest in who they are.
http://www.thefrisky.com/,HIGH,Left Bias,The Frisky is a womens entertainment and lifestyle website which was launched in 2008. When covering political news they have a left wing bias with loaded words and story selection. Though biased they do source to credible information.
http://thegrio.com/,HIGH,Left Bias,TheGrio is an American website with news; opinion; entertainment and video content geared toward African Americans.TheGrio is one of the largest news sources for black America. Originally launched in June 2009 as a division of NBC News;it became a division of MSNBC in 2013. Covers a lot of entertainment news; but also does cover politics with a left wing bias and typically sources properly.
https://theintellectualist.co/,HIGH,Left Bias,The Intellectualist is a news aggregation website that primarily usesleft-center sources. Most sources are credible; however we rate the Intellectualist left biased because almost all stories are favorable to the left or damaging to the right. The Intellectualist is factual in sourcing; but biased based on story choices. (3/9/2017)
http://www.themilitant.com/,HIGH,Left Bias,The Militant is an international Socialist newsweekly connected to the Socialist Workers Party (SWP) and the Pathfinder Press.It is published in the United States and distributed in other countries such as Canada; the United Kingdom; Australia; France; Sweden; Iceland; and New Zealand. Has a left wing socialist bias in reporting; but does not use loaded words and sources well.
http://www.morningstaronline.co.uk/,HIGH,Left Bias,Morning Star is a left-wing British daily tabloid newspaper with a focus on social; political and trade union issues. Articles and comment columns are contributed by writers from socialist; communist; social democratic; green and religious perspectives. Uses strong words with a liberal bias and has sensational headlines. Mostly links to credible sources. (5/15/2016) Updated (4/26/2017)
https://www.thenation.com/,HIGH,Left Bias,The Nation is the oldest continuously published weekly magazine in the United States; and the most widely read weekly journal of progressive political and cultural news; opinion and analysis. Founded in 1865; The Nation produces well written journalism that is factual and well sourced. They demonstrate left wing bias in story choices and wording. (5/15/2016) Updated (4/26/2017)
http://www.nationalmemo.com/,HIGH,Left Bias,The National Memo is an American online news site and newsletter. Founded in 2011 by award-winning journalist and editor Joe Conason; features daily breaking news and commentary as well as analysis from Americas top progressive thinkers.With a focus on American politics; The National Memo also covers world news and events; consumer finance; health; travel and entertainment. The National Memo is always well sourced and factual; but the bias clearly favors the left in almost every story. This is a solid source for credible information; but on a whole this source does not always cover both sides of the story.
http://www.thenewcivilrightsmovement.com/,MIXED,Left Bias,The New Civil Rights Movement is a website news source that promotes civil rights for LGBT people. They use strong left biased language regarding conservatives and have an unproven claim from Snopes.
http://other98.com/,MIXED,Left Bias,The Other 98% is a non-profit activist group that are tired of corporate control of our government; our institutions; and our planet. Their primary mission is to get money out of politics and reduce corporate influence. They present information with a left wing bias regarding reporting and wording. They also have a mixed file from Politifact.
http://www.progressive.org/,HIGH,Left Bias,The Progressive is an American monthly magazine of politics; culture and progressivism with a pronounced liberal perspective. Founded in 1909 by Senator Robert Fighting Bob La Follette; it was originally called La Follettes Weekly and then simply La Follettes.In 1929; it was recapitalized and had its name changed to The Progressive (Wikipedia). The Progressive has a left wing bias in story selection. They source all stories to credible information.
http://www.theroot.com/,HIGH,Left Bias,The Root is an English-language American online magazine of African-American culture launched on January 28; 2008; by Henry Louis Gates; Jr. and Donald E. Graham; and was owned by Graham Holdings Company (Wikipedia). Solid evidence based reporting with a left wing bias in wording and political affiliation.
http://www.villagevoice.com/,HIGH,Left Bias,The Village Voice was created in 1955 as a platform for the creative community. As the nations first alternative newsweekly; The Village Voice introduced free-form; high-spirited; and passionate journalism into the public discourse. The recipient of three Pulitzer Prizes; the National Press Foundation Award and the George Polk Award; The Village Voice remains a go-to source for coverage of New Yorks politics and vast cultural landscape. The Village Voice produces high quality journalism and sources political information well. It does however have a left wing bias in what it reports and the use of emotional (loaded) words.
https://thewalrus.ca/,HIGH,Left Bias,The Walrus is a Canadian general interest magazine which publishes long-form journalism on Canadian and international affairs; along with fiction and poetry by Canadian writers . The Walrus produces high quality liberal journalism that is factually sourced.
http://thinkprogress.org/,MIXED,Left Bias,ThinkProgress is an American political news blog. It is a project of the Center for American Progress; a progressive public policy research and advocacy organization. Has a left wing bias in story selection and has failed some fact checks including these from Snopes. (5/15/2016) Updated (2/24/2017)
https://this.org/,HIGH,Left Bias,This Magazine is an independent alternative Canadian political magazine. Has a left wing bias in story selection and is usually factually sourced.
http://www.towleroad.com/,MIXED,Left Bias,Towleroad is blog founded by Andy Towleand isbased in New York City. Towle; who is gay; started his blog Towleroad in 2003.The blog focuses on gays; pop culture; photography; politics; media; entertainment; technology; and travel. Towleroad uses strong loaded language with a far left bias in reporting. Most articles are sourced reasonable well; but their is significant opinion interjected into each article.
http://www.tribunemagazine.org/,HIGH,Left Bias,Tribune is a democratic socialist fortnightly newspaper; founded in 1937 and published in London. It has always been independent but has usually supported the Labour Party from the left. Has a left wing political bias; but is well sourced to credible information.
http://www.truthdig.com/,HIGH,Left Bias,Truthdig is a news website that provides a mix of long-form articles; interviews; and blog-like commentary on current events; delivered from a politically progressivepoint of view. Truthdig has a left wing bias in what they choose to report and the words they use; but the articles are generally well written and reasonably sourced. (11/18/2016)
http://www.truth-out.org/,MIXED,Left Bias,Truthout is a 501(c)(3) nonprofit; progressive news organization in the United States that operates a web site and distributes a daily newsletter. Registered in September 2001; in Sacramento; California; Truthout publishes original political news articles; opinion pieces; video reports and artwork. According to its web site; Truthout works to broaden and diversify the political discussion by introducing independent voices and focusing on under covered issues and unconventional thinking. Truthout has a strong left wing bias in reporting choices and wording. They also have reported some stories that were not factual. For example; a reporter claimed that Karl Rove was indicted on charges when in fact he wasnt. The reporter continued to make the claim without evidence. See link here. Although this is only one example it shows that this source should be checked when in doubt. (5/15/2016) Updated (4/26/2017)
http://uproxx.com/,HIGH,Left Bias,Uproxx is an American digital media company that covers entertainment and culture. It was founded in 2008 by Jarret Myer and Brian Brater and acquired by Woven Digital in 2014. The sites target audience is males aged 18-34. Uproxx has a left wing political affiliation in reporting. They are generally factual and source to credible information. (10/3/2016)
https://www.upworthy.com/,HIGH,Left Bias,Upworthy is a website for viral content started in March 2012 by Eli Pariser; the former executive director of MoveOn; and Peter Koechley; the former managing editor of The Onion.It uses virality to promote stories with a progressive bent on political and social issues. Upworthy claims to fact check every post; we couldnt find anything to dispute this. They do however have a left wing bias in story selection. (5/15/2016) Updated (6/2/2017)
http://theuspoliticalpost.com/,MIXED,Left Bias,US Politcal Post is a News and Opinion blog with left wing bias in reporting. As of 12/22/16 this source does not appear to be active any longer.
http://usuncut.com/,MIXED,Left Bias,US Uncut has overt left wing bias in story selection and wording. Does not have an about or mission page to explain its positions. Does not provide biographies for its writers. Not all articles are well sourced and are highly sensationalized. Requires fact checking against reliable sources. (5/15/2016)
http://www.vanityfair.com/,HIGH,Left Bias,Vanity Fair is a magazine of popular culture; fashion; and current affairs published by Cond Nast (Wikipedia). Vanity Fair also publishes political content that has a moderate left wing bias. This is seen in several articles critical of conservatives and positive in favor of more liberal politicians. Overall; Vanity Fair is well written and mostly factual; but there is a clear left wing bias.
http://vote.us.org/,MIXED,Left Bias,Vote is a news and opinion blog with a left wing bias in reporting. Most articles favor liberals and oppose conservatives. There is some use of loaded words; which is to be expected from a mostly opinion based website. Due to this source writing mostly opinion pieces we rate it mixed for factual reporting as sourcing is limited. (6/3/2017)
http://www.vox.com/,HIGH,Left Bias,Vox is an American advocacy news website run by Vox Media; co-founded by liberal columnists Ezra Klein; Melissa Bell; and Matt Yglesias and launched in April 2014. Vox presents with left wing bias in reporting and story choices. There is some use of loaded words; but most articles are sourced to credible information. (5/15/2016)
http://washingtonmonthly.com/,HIGH,Left Bias,Washington Monthly is a bimonthly nonprofit magazine of United States politics and government that is based in Washington; D.C.Has a liberal bias in reporting and word choices.
http://wonkette.com/,MIXED,Left Bias,Wonkette is a news and opinion website with a very strong liberal bias. They sometimes post tongue in cheek articles that can be misleading. Overall; they source their information and will correct factual errors when they occur. Although they are very biased in their wording and content they are reliable for information. (5/15/2016) Updated (3/10/2017)
https://tytnetwork.com/,HIGH,Left Bias,The Young Turks (TYT) is an American political commentary web series that was created by journalist Cenk Uygur; Ben Mankiewicz and Dave Koller. Currently co-hosted by Uygur and Ana Kasparian; its stance isprogressive/left-wing; although its primary focus is on political commentary; the program provides opinion on topics of varying news genres. Although very left biased in delivery the Young Turks do a decentjob of sourcing their information with credibility.
https://zcomm.org/zmag/,HIGH,Left Bias,Z Magazine was established in 1987.It is published in print and on-line. Contributors to the magazine include Noam Chomsky;Edward S. Herman;Mike Kuhlenbeck;Jack Rasmas;Paul Streetand Kevin Zeese. Has a distinct Libertarian-Socialist-Anarchist Bias.
