http://www.nber.org/,HIGH,Least Biased,Founded in 1920; the NBER is a private; non-profit; non-partisan organization dedicated to conducting economic research and to disseminating research findings among academics; public policy makers; and business professionals.The NBER is the nations leading nonprofit economic research organization. Twenty-six Nobel Prize winners in Economics and thirteen past chairs of the Presidents Council of Economic Advisers have held NBER affiliations. It is very important to note that the research papers produced by NBER are working papers and are not peer reviewed. In other words; the research is open to discussion and criticism. Some papers may contain bias and some could in fact be wrong. We give this source a least biased rating because the economists who are affiliated with the group come from all political affiliations. We give them a high factual reporting rating based on these papers being working papers and not stated as definitive fact. (D. Van Zandt 3/23/2017)
https://www.nationaljournal.com/,HIGH,Least Biased,National Journal is an American digital media company based in Washington; D.C.; that covers the current political environment and emerging political and policy trends. National Journal was first published in 1969 . Offers straightforward journalism with minimal bias.
http://www.newbernsj.com/,HIGH,Least Biased,The Sun Journal is the daily newspaper in New Bern; North Carolina; United States. The New Bern Sun Journal reports news with very low bias and is factually sourced. The editorial content has a slight lean to the left based on topic selection; but not enough to justify moving this source from the least biased category. (6/12/2017)
https://newsela.com/,HIGH,Least Biased,Newsela is a data base of current events stories tailor-made for classroom use. Stories are indexed by broad theme; thatare both student-friendly and can be accessed in different formats by reading level. Newspaper writers rewrite a story four times for a total of five Lexile levels per story. Newselas content providers are the Washington Post; The Guardian; Scientific American and Tribune Content Agency.
http://www.newsnow.co.uk/h/,MIXED,Least Biased,NewsNow is a news aggregator service that was launched in 1998. NewsNow searches over 33;000 sources from all over the world in real time. Like most news aggregators NewNow has minimal bias. However; the sources they serve may have bias; therefore it is up to the consumer to determine the bias of each source.
http://www.nextavenue.org/,HIGH,Least Biased,Next Avenue is a digital platform launched by PBS that offers original and aggregated journalism aimed at baby boomers. Next Avenue is PBS first venture to begin on the Internet rather than on broadcast television. Most news is geared to health; nutrition and political policy for aging baby boomer. Has minimal bias in reporting.
http://www.nextgov.com/,HIGH,Least Biased,Nextgov is the all-day information resource for federal technology decision makers. Bias is determined by the author; but for the most part they are pretty neutral. (8/26/2016)
https://www3.nhk.or.jp/nhkworld/,HIGH,Least Biased,NHK World is the international broadcasting service of NHK; Japans public broadcaster. The service is aimed at the overseas market; similar to Arirang; BBC World News; DW; France 24 and RT; and broadcast through satellite and cable operators throughout the world as well as online and through its mobile apps. The channel is based in Tokyo; Japan. NHK provides low biased international news that is factual.
http://www.novinite.com/,HIGH,Least Biased,Based in Bulgaria. Has low biasedreporting on American news and politics. (7/9/2016)
https://www.nolabels.org/,HIGH,Least Biased,No Labels is an American political organization based in the United States; composed of Republicans; Democrats; and independents; whose mission is to usher in a new era of focused problem solving in American politics.No Labels is a movement that includes citizens; current and former members of Congress; state and local officials; and business; union; nonprofit and student leaders from across the political spectrum who advocate a new politics of problem solving.The groups core mission is to organize leaders and citizens across America who want elected officials in Washington to give up their all-or-nothing partisan approach to politics and focus on solving the nations most pressing challenges. Essentially; this is a group that hopes to find bipartisan solutions to our nations problems. This is not really a news source; but they do have a blog that is usually well written and sourced properly. There is very little political bias.
http://180report.com/,MIXED,Least Biased,OneEighty or 180Report.com is a news aggregation website that pulls news from a variety of sources. The website has a button you can click to get news from right biased websites or left biased. The sources they pull from are typically large known sources such as The Blaze or Huffington Post. While the content of the individual news sources are verybiased; we are giving OneEighty the least biased designation because they are pulling news from both sides without commentary.
http://www.openthegovernment.org/,HIGH,Least Biased,According to their mission:Open The Government seeks to advance the publics right to know and to reduce unnecessary secrecy in government. They achieve this by publishing news related to government transparency. Their is minimal bias in presentation of news and all information is sourcedto mostly official government sources.
http://www.patheos.com/,MIXED,Least Biased,Patheos is a non-denominational; non-partisan online media company providing information and commentary from various religious and nonreligiousperspectives. With that said; Patheos is very hard to classify on a right-left perspective. Patheos has 450 writers/bloggers covering 11 different religious categories including paganism and atheism. Obviously there is a lot of opinion on this website; but because they cover all perspectives in one place we give them a least biased rating. However; any individual writer on this website may possess left; right bias or advocate for pseudoscience. It is up to the reader to decide on the bias of each writer. (11/18/2016)
http://www.pgpf.org/,HIGH,Least Biased,The Peterson Foundation has grants issued to other organizations regardless of political affiliation. Their primary focus is on fair and balanced budgets and the future of the US. They stick to reporting facts and figures with opinion pieces mixed in on occasion. They have donated to Clinton; Bush; Heritage fund and several left leaning organizations making them very moderate in their views. Theres little extremism as they talk of carbon tax & fair tax taking from both sides of the aisle. They have an array of speakers from Bill Clinton to Alan Greenspan to Chris Christie. Showing a bipartisan and moderate approach to fiscal policy and taxation. PETER G. PETERSON; for who the foundation is named after; served under Nixon and Clinton. According to Wikipedia he has been quoted as saying; I remain aRepublican; but the Republicans have become a far more theological; faith-directed party; not troubling with evidence. (M. Allen)
https://piie.com/,HIGH,Least Biased,The Peterson Institute for International Economics (PIIE; Peterson Institute) is a private and non-profit think tank focused on international economics; based in Washington; D.C. It was founded by C. Fred Bergsten in 1981; and is led by Adam S. Posen. According to the 2015 Global Go To Think Tank Index Report (Think Tanks and Civil Societies Program; University of Pennsylvania); Peterson is number 20 (of 150) in the Top Think Tanks Worldwide and number 13 (of 60) in the Top Think Tanks in the United States. PIIE has minimal bias and reports using evidence. This is a neutral economic source.
http://www.pewresearch.org/,VERY HIGH,Least Biased,Pew Research is a nonpartisan American think tank which is based in Washington; D.C. It provides information on social issues; public opinion; and demographic trends shaping the United States and the world. It also conducts public opinion polling; demographic research; media content analysis; and other empirical social science research. Pew Research Center does not take explicit policy positions. Pew is very factual and is mostly unbiased in reporting. (7/10/2016) Updated (4/26/2017)
https://placesjournal.org/,VERY HIGH,Least Biased,Places Journal is a resource on the future of architecture; landscape; and urbanism.Founded at MIT and Berkeley in 1983; Places has been online and free since 2009. Places Journal is very well sourced and always evidence based. This is very well written professional journalism. (3/17/2017)
http://www.politicalstorm.com/,HIGH,Least Biased,According to their website Political Storm is a new concept; a truly bipartisan place where everyday Americans from all walks of life and from the full political spectrum can have their voice heard and engage in respectful but passionate dialogue. It is rare that a website claims to be bipartisan and actually delivers. Political Storm features writers from both the right and left and yes they do convey bias. We give this source a least bias rating because they do cover both sides by allowing public debate on the issues. In the articles reviewed today all were well sourced to factual information regardless of their individual bias. However; many articles did tend to favor the right. When using this source take each article individually rather than judging the source as a whole. (4/10/2017)
http://www.politifact.com/,VERY HIGH,Least Biased,PolitiFact.com is a project operated by the Tampa Bay Times; in which reporters and editors from the Times and affiliated media outlets fact-check statements by members of Congress; the White House; lobbyists and interest groups.They publish original statements and their evaluations on the PolitiFact.com website; and assign each a Truth-O-Meter rating. The ratings range from True for completely accurate statements to Pants on Fire (from the taunt Liar; liar; pants on fire) for false and ridiculous claims. Politifact has been called left biased by Extreme right wing and questionable sources.Our research indicates that Poltifact is an accurate fact checker and is considered the gold standard for political fact checking. (7/10/2016)
http://www.polygraph.info/,VERY HIGH,Least Biased,Polygraph.info is a fact-checking website produced by Radio Free Europe/Radio Liberty and Voice of America (VOA). The website serves as a resource for verifying the increasing volume of disinformation and misinformation being distributed and shared globally. Well sourced fact checker that is currently focused on Russian claims. (12/1/2016)
http://www.poynter.org/,VERY HIGH,Least Biased,The Poynter Institute for Media Studies is a non-profit school for journalism located in St. Petersburg; Florida. The school is the owner of TheTampa Bay Times newspaper. The school began on May 29; 1975. This a low bias source with outstanding writing and journalism. They also perform comprehensive Fact Checks.
http://pogo.org/,VERY HIGH,Least Biased,The Project On Government Oversight (POGO); founded in 1981; is an independent non-profit organization in the United States which investigates and seeks to expose corruption and other misconduct. POGO assists whistleblowers and investigates federal agencies; Congress; and government contractors. This is a solid evidence based source. (12/8/2016)
http://www.publicpolicypolling.com/,VERY HIGH,Least Biased,Public Policy Polling (PPP) is a U.S. Democraticpolling firm based in Raleigh; North Carolina. Political research firm YouGov found PPPs gubernatorial polls to have the lowest average margin of error among national firms that polled in at least ve gubernatorial races in the month preceding the election.In 2013 columnist Nate Cohn described PPP as a liberal pollster;although according to statistician Nate Silver; PPP had a tendency to slightly lean Republican as of September 2016.
http://www.prri.org/,VERY HIGH,Least Biased,The Public Religion Research Institute (PRRI) is an American nonprofit; nonpartisan research and education organization that conducts public opinion polls on a variety of different topics. PRRI is a public resource for journalists; scholars; policy makers and the general public. PRRI is a member of the National Council of Public Polls and is a founding member of the Transparency Initiative at the American Association of Public Opinion Research. (11/3/2016)
http://parallax.news/,HIGH,Least Biased,This source asks a topical question and then presents 3 different perspectives from political figures or experts. The people may be biased; but the presentation by the site is non-biased and informative. (7/10/2016)
http://www.news.cn/english/,HIGH,Least Biased,Daily newspaper from China that presents mostly unbiased reporting of international and USA news. (7/29/2016)
http://reporterslab.org/,VERY HIGH,Least Biased,The Reporters Lab explores new forms of journalism; including fact-checking; empowering democracies and holding governments accountable; and structured journalism; which creates new forms of storytelling and beat reporting. The Reporters Lab has minimal bias and is highly factual.
https://represent.us/,HIGH,Least Biased,A website dedicated to ending corruption in politics. Does have a slight left leaning bias; but generally factual in news and data.
http://www.reuters.com/,VERY HIGH,Least Biased,A highly reputable news reporting service. Reuters has a policy of taking a value-neutral approach. Reuters editorial policy states: We are committed to reporting the facts and in all situations avoid the use of emotive terms. The only exception is when we are quoting someone directly or in indirect speech. Reutersdoes not offer opinion and just reports news. (7/10/2016)
https://www.riverbender.com/,HIGH,Least Biased,Riverbender is a portal serving local and national news; classifieds; event calendars and Alton guides to restaurants; shopping and attractions with coupons. Riverbender provides local news with minimal bias and also uses the Associated Press to deliver news to the website.
http://www.rollcall.com/,VERY HIGH,Least Biased,Roll Call is a solid just the facts news source; featuring a writing staff with an impressive set of credentials in political journalism. The articles are well sourced; and the information is presented as is with very minimal bias. While looking through the articles one in particular caught my attention. The article addressed the much hyped; on both sides; possibility of using National Guard troops to assist ICE in finding and deporting illegal immigrants. There is no real substance to the claim at this point; which came from an early draft of a what if style memo that never reached any official level. Ive read numerous articles on the issue; and Roll Calls article was the fairest and least biased I have seen.
http://sciencedebate.org/,VERY HIGH,Least Biased,Science Debate is a website dedicated to getting politicians to discuss scientific issues.
http://www.scoopnest.com/,HIGH,Least Biased,Scoopnest is an online service that collects news tweets from a wide range of sources. They also provide the ability to filter by topics such as politics or health; etc. The Twitter sources it pulls from range from left to right and in the middle. While this source does pull information from biased sources; Scoopnest itself is not providing commentary and remains neutral. Hence we give Scoopnest a least biased rating for providing news from all sources.
http://www.scotusblog.com/,HIGH,Least Biased,SCOTUSblog is a law blog written by lawyers; law professors; and law students about the Supreme Court of the United States.The site tracks cases before the Court from the certiorari stage through the merits stage. The site live blogs as the Court announces opinions and grants cases; and sometimes has information on the Courts actions published before either the Court or any other news source does. In reviewing this source I could not find any use of loaded language and all content was factually based. Most information is simply reporting of what is happening. This is a low biased source for SCOTUS information. (D. Van Zandt)
http://www.snopes.com/,HIGH,Least Biased,Fact checking and myth debunking site. Well sourced and accurate. (7/10/2016)
http://www.sctimes.com/,HIGH,Least Biased,The St. Cloud Times is a newspaper from St. Cloud Minnesota. The newspaper is owned by Gannett Company which also owns the USA Today and numerous other newspapers within the United States. The St. Cloud Times publishes similar news stories as the USA Today and is least biased in reporting news. The editorial content has a slight left of center bias; but not enough to move this source out of the least biased category. (6/12/2017)
https://www.stripes.com/,HIGH,Least Biased,Stars and Stripes is an American military newspaper that focuses and reports on matters concerning the members of the United States Armed Forces. It operates from inside the Department of Defense; but is editorially separate from it; and its First Amendment protection is safeguarded by the United States Congress; to whom an independent ombudsman; who serves the readers interests; regularly reports. Stars and Stripes is balanced in reporting and is low in editorial bias. They source to credible information.
https://www.statnews.com/,HIGH,Least Biased,According the Stat about page: STAT delivers fast; deep; and tough-minded journalism. We take you inside science labs and hospitals; biotech boardrooms; and political backrooms. We dissect crucial discoveries. We examine controversies and puncture hype. We hold individuals and institutions accountable. We introduce you to the power brokers and personalities who are driving a revolution in human health. STAT is produced by Boston Globe Media. In my review of this site I feel that STAT delivers on their mission. Articles are well researched and direct; without use of loaded words. There is a very slight leftward bias in story selection; but not enough to move to the Left-Center category.
http://stimson.org/,HIGH,Least Biased,Founded in 1989; the Stimson Center is a nonprofit; nonpartisan think tank devoted to addressing transnational challenges in order to enhance global peace and economic prosperity. Given 5-Star (Highly Transparent) rating by Transparifys 2015 report. (8/18/2016)
https://stocknewsusa.com,HIGH,Least Biased,Stock News USA is a news website that presents news with minimal bias. Headlines are not sensational and all stories have links to credible sources. Essentially; Stock News USA takes top news stories of the day and repackages them as direct;easy to read stories.
https://www.stratfor.com/,HIGH,Least Biased,Stratforis an American publisher and global intelligence company founded in 1996 in Austin; Texas; by George Friedman; who was the companys chairman. Stratfor is a well respected source for military intelligence.
http://sunlightfoundation.com/,VERY HIGH,Least Biased,The Sunlight Foundation is an American 501(c)(3) nonpartisan; nonprofit organization that advocates for open government.The organization was founded in April 2006 with the goal of increasing transparency andaccountability in the United States Congress; the executive branch; and in state and local governments.The foundations primary focus is the role of money in politics. The organization seeks to increase campaign finance regulations and disclosure requirements. The Sunlight Foundations donors include the Open Society Foundations; The Pew Charitable Trusts; the John S. and James L. Knight Foundation; theRockefeller Foundation; the Ford Foundation; the William and Flora Hewlett Foundation; the Omidyar Network; Bloomberg Philanthropies; and the Laura and John Arnold Foundation. Sunlight is a great resource for tracking money in politics and has minimal bias.
http://taskandpurpose.com/,HIGH,Least Biased,Task and Purpose (TAP) is a military centric web site that covers a wide range of military related subjects. The content ranges from current affairs to gear and gadgets; with a focus on veterans; the men and women currently serving; and their families. While the Opinion page does reveal a slight Left Bias overall; it is confined to the Opinion page; as is appropriate. Despite the sometimes controversial nature of the content covered; the articles on TAP are consistently apolitical; presenting the facts with a minimum of editorializing. The factual; well sourced; and fairly presented content; combined with the overall quality of the site; earns TAP a Least Biased rating. (D. Kelley 4/24/2017)
https://www.texastribune.org/,HIGH,Least Biased,The Texas Tribune is a nonprofitmedia organization based in Austin; Texas. Its website and content in various delivery platforms serves as an alternative news source for Texas; with a goal of supplementing mainstream media sources. Low biased reporting that leans just slightly left through reporting.
http://www.thatsnonsense.com/,HIGH,Least Biased,Thats Nonsense is a resource for internet and social media scams and hoaxes.
https://www.thebureauinvestigates.com/,HIGH,Least Biased,The Bureau of Investigative Journalism (typically abbreviated to TBIJ or the Bureau) is a nonprofit news organisation based in London. It was founded in 2010 to pursue public interest investigations; funded through philanthropy.The Bureau works with publishers and broadcasters to maximize the impact of its investigations. TBIJ is always very well sourced; factual and written professionally. This is a strong source for deep investigations that are evidence based.
http://www.chronicle.com/,High,Least Biased,The Chronicle of Higher Education is a newspaper and website that presents news; information; and jobs for college and university faculty and Student Affairs professionals (staff members and administrators). A subscription is required to read some articles.
https://theconversation.com/us,HIGH,Least Biased,The Conversation is an independent; not-for-profit media outlet that uses content sourced from the academic and research community. Presents news with a centrist view point and relatively non-biased journalism. (7/10/2016)
http://thediplomat.com/,HIGH,Least Biased,The Diplomat is an online international news magazine covering politics; society; and culture in the Asia-Pacific region. It is based in Tokyo; Japan. Reporting with neutral wording and low bias. (8/16/2016)
http://www.economist.com/,HIGH,Least Biased,The Economist is an English-language weekly news magazine owned by the Economist Group and edited in offices in London. Centrist views and straightforward non-biased reporting. They carefully label opinion pieces. (7/10/2016)
http://www.fakenewscodex.com/,HIGH,Least Biased,The Fake News Codexis a website created to identify news sites that are fake; extremely misleading; or satirical. They do not list highly biased sites; but rather focus solely on Fake News sources. Many of the sites listed on The Fake News Codex are also listed on our website in the Conspiracy; Satire or Questionable Source categories. All in all the site is laid out nicely and is a goodresource.
https://thehumanist.com/,HIGH,Least Biased,The Human Magazine is published by the American Humanist Association. It is a Bi-monthly publication thatcovers everything from science and religion to media and technology to politics and popular culture. Extremely well sourced and factual. Leans slightly to the left politically.
http://indianexpress.com/,HIGH,Least Biased,The Indian Express is an English-language Indian daily newspaper. It is published in Mumbai by Indian Express Group. Low biased coverage of the USA. (10/27/2016)
http://www.thejakartapost.com/,HIGH,Least Biased,The Jakarta Post is a daily English language newspaper in Indonesia. The paper is owned by PT Bina Media Tenggara; and the head office is in the nations capital; Jakarta. The Jakarta Post has some state bias; but reports very factually on international news. They have won journalism awards for their coverage if international politics.
http://www.jpost.com/,HIGH,Least Biased,The Jerusalem Post is a broadsheet newspaper based in Jerusalem; publishing only English and French editions. Formerly regarded as left-wing; the paper underwent a noticeable shift to the right in the late 1980s.From 2004; under then editor-in-chief David Horovitz; the paper took a more centrist position. Is biased towards Israel; but very centrist in world affairs. (8/29/2016)
http://www.thejournal.ie/,HIGH,Least Biased,TheJournal.ie is an internet news publication in Ireland. It is a mixture of original and aggregated content. Founded in 2010 and is a low bias source. (11/29/2016)
https://www.themarshallproject.org/#.qjbbuljBK,HIGH,Least Biased,The Marshall Project is a nonprofit nonpartisan online journalism organization focusing on issues related to criminal justice in the United States; led by former hedge fund manager Neil Barsky and former New York Times executive editor Bill Keller. Present information with minimal bias and proper sourcing.
http://memepoliceman.com/,HIGH,Least Biased,Meme Policeman (MP) is a site that fact checks memes to; as their tagline states; Protect And Serve Against False And Misleading Memes. In that; MP does an excellent job of deconstructing memes from both the left and the right. The articles are factual; well sourced; and well written. There is a slight overall right bias both in tone and in the conclusions drawn from the source data; but the factual; well sourced articles and overall quality of the reporting far outweigh the mild bias; and earns MP a rating of Least Biased. (D. Kelley)
