http://kuow.org/,HIGH,Left-Center Bias,Seattle based National Public Radio. Presents news with a left-center bias in reporting. Well sourced and factual. (5/18/2016)
http://www.latimes.com/,HIGH,Left-Center Bias,The Los Angeles Times; commonly referred to as the Times or LA Times; is a paid daily newspaper published in Los Angeles; California; since 1881. It was the largest metropolitan newspaper in circulation in the United States in 2008 and the fourth most widely distributed newspaper in the country. Well sourced with a left-center editorial bias. (5/18/2016)
https://www.lawfareblog.com/,HIGH,Left-Center Bias,Lawfare Blog is a blog dedicated to national security issues; published by the Lawfare Institute in cooperation with the Brookings Institution. Lawfare Blog is factual in reporting and always well sourced. There is a left-center bias in reporting choices that slightly favor liberals. Overall; this is a reliable source for security and legal information.
http://lawnewz.com/,HIGH,Left-Center Bias,Law Newz is founded and run by Dan Abrams;who is currently the Chief Legal Anchor for ABC News; and host of both 60 Days In and Live PD on the A&E network. Has a slight left bias in reporting; but is well sourced. (10/30/2016)
http://www.leftjustified.com/,HIGH,Left-Center Bias,Left Justified is a news and opinion website with a left leaning bias in reporting. Left Justified does not have many articles posted and seems to be quite inactive. Of the articles posted all are well sourced and factual with minimal loaded words. They lean left in story selection that tends to favor liberals; otherwise this source is pretty solid.
http://lethbridgeherald.com/,HIGH,Left-Center Bias,The Lethbridge Herald is the leading daily newspaper in greater Lethbridge; Alberta; Canada. Well sourced reporting with a left-center editorial position.
http://www.kentucky.com/,HIGH,Left-Center Bias,The Lexington Herald-Leader is a newspaper owned by The McClatchy Company and based in the U.S. city of Lexington; Kentucky. The newspaper has won the 1986 Pulitzer Prize for Investigative Reporting; the 1992 Pulitzer Prize for Editorial Writing and the 2000 Pulitzer Prize for Editorial Cartooning. It had also been a finalist in six other Pulitzer awards in the 22-year period up until its sale in 2006; a record that was unsurpassed by any mid-sized newspaper in the United States during the same time frame. The Lexington Herald Leader reports accurately and is well sourced. They have a left-center editorial bias and endorse Democratic candidates.
https://www.liveleak.com/,HIGH,Left-Center Bias,Liveleak is a video service founded by Hayden Hewitt. The content is almost exclusively user submitted videos and covers a wide range of topics from around the world. From peoples pets to Rex Tillersons trip to Asia. Because of the conflicts in Syria and the Ukraine; and the amount of video being uploaded from there; they currently have two sections dedicated to them. Due to being a video sharing service; and the videos being presented as submitted; the content can be very graphic and controversial; such as when Liveleak hosted footage of the beheading of journalist James Foley by ISIS in 2014. Mr. Hewitt has defended the practice of presenting submitted footage as is; stating in his own words:
http://www.macleans.ca/,HIGH,Left-Center Bias,Macleans is a Canadian weekly news magazine that was founded in 1905; reporting on Canadian issues such as politics; pop culture; and current events. Has left of center bias in reporting and wording; but well sourced and factual. (11/28/2016) Updated (7/14/2017)
https://medium.com/,MIXED,Left-Center Bias,Medium is an online publishing platform developed by Twitter co-founder Evan Williams; and launched in August 2012. It is legally owned by A Medium Corporation.The platform is an example of evolved social journalism; having a hybrid collection of amateur and professional people and publications; or exclusive blogs or publishers on Mediumand is regularly regarded as a blog host. We really are not sure where to place this source. Medium has a variety of writers from many different political perspectives. We sampled 10 top stories and 6 out of 10 leaned left. That doesnt mean it represents the entirety of the site. We gave this source a mixed factual reporting rating because many authors on Medium are not journalists. (5/14/2016) Updated (7/8/2017)
http://www.metro.us/,HIGH,Left-Center Bias,The Metro is published in more than 100 major cities across Europe; North & South America and Asia and reaches an audience of 18 million daily.Designed for a 20-minute read; the paper gives metropolitans all they need to know; Monday through Friday; during their morning commutes. Metro sources properly and is factual. There is a left-center bias in reporting and editorial content.
http://metro.co.uk/,HIGH,Left-Center Bias,Metro is a free newspaper published in tabloid format in the United Kingdom by DMG Media (part of Daily Mail and General Trust). The Metro primarily covers entertainment and local news; but also occasionally politics with a left-center bias in wording and story selection.
http://mexiconewsdaily.com/,HIGH,Left-Center Bias,Curates news stories from Mexico in English. Bias is determined by the sources they curate.
http://www.miamiherald.com/,HIGH,Left-Center Bias,The Miami Herald is a daily newspaper owned by the McClatchy Company and headquartered in Doral; Florida; a city in western Miami-Dade County several miles west of Miami.Founded in 1903; it is the second largest newspaper in South Florida; serving Miami-Dade; Broward County; and Monroe County. It also circulates throughout Latin America and the Caribbean. (7/16/2016)
http://www.miaminewtimes.com/,HIGH,Left-Center Bias,The Miami New Times is a free weekly newspaper published in Miami and distributed every Thursday. Has a left-center bias in reporting. Well sourced.
https://mic.com/,HIGH,Left-Center Bias,Mic (formerly PolicyMic) is a media company that targets millennials.The company reaches 19 million unique monthly visitorsand has a higher composition of 18- to 34-year-old readers than any other millennial-focused news site; including BuzzFeed and Vice. Mic has a left of center bias in reporting; but they are factual and source to other credible sources.
http://www.jsonline.com/,HIGH,Left-Center Bias,The Milwaukee Journal Sentinel is a daily morning broadsheet printed in Milwaukee; Wisconsin. It is the primary newspaper in Milwaukee; the largest newspaper in Wisconsin and is distributed widely throughout the state. It is owned by the Gannett Company. Gets its news from the USA Network which is centrist; but has a left-center editorial bias.
http://www.startribune.com/,HIGH,Left-Center Bias,The Star Tribune is the largest newspaper in the U.S. state of Minnesota. Is well sourced with a left-center editorial bias. (7/29/2016)
http://www.mintpressnews.com/,HIGH,Left-Center Bias,MintPress News is an independent Minnesota-based news website launched in 2012. It covers political; economic; foreign affairs and environmental issues. Mint Press has a left wing bias in reporting; but is well source and evidence based in reporting. (5/18/2016) Updated (1/12/2017)
http://monthlyreview.org/,HIGH,Left-Center Bias,The Monthly Review; established in 1949; is an independent socialist magazine published monthly in New York City. As of 2015 the publication remains the longest continuously published socialist magazine in the United States. The journal has an impact factor of 0.460. Has an obvious left wing political bias; but as an academic journal is evidence based.
http://montrealgazette.com/,HIGH,Left-Center Bias,A daily English newspaper from Montreal; Canada. Canadas oldest newspaper. Has a left-center editorial bias. (7/27/2016)
https://morningconsult.com/,HIGH,Left-Center Bias,Morning Consult is a nonpartisan digital media and survey research company established in 2013. The company provides news coverage; survey research; and data technology tools on issues in politics; policy and business. Morning Consult is the official polling partner of POLITICO; Vox; Fortune; and Bloomberg News. Very evidence based reporting; with just slight left of center bias in story selection.
https://themoscowtimes.com/,HIGH,Left-Center Bias,The Moscow Times (MT) is an English-language weekly newspaper published in Moscow; with a circulation of 35;000 copies. It is distributed for free at places frequented by English-speaking expatriates such as hotels; cafs; embassies; and airlines. It is also available by subscription; but it is not available at newsstands. The newspaper is very popular among foreign citizens residing in Moscow and English-speaking Russians. The Moscow Times hasbeen called amilitant anti-Putin paper; a digest of the Western press with extreme bias in covering events in Russia. MT generally covers Western news with a left-center bias in reporting and wording. They are usually factually sourced.
http://www.msn.com/,HIGH,Left-Center Bias,MSN is a web portal and related collection of Internet services and apps for Windows and mobile devices; provided by Microsoft and launched on August 24; 1995; the same release date as Windows 95. MSN aggregates news from a wide variety of mainstream sources. Most news comes from left-center and least biased sources. Based on the majority of news coming from left-center sources we rate MSN left-center for content and reporting.
http://natmonitor.com/,HIGH,Left-Center Bias,National Monitor (NM) is an online news and opinion site managed by Paul Kilmartin. NMs goal; as stated in their tagline; is to present Opinions and analysis from all angles. In this they are largely successful; offering articles from the far left to the far right; and everything in between. The articles from the staff writers on NM are consistently well written; factual; and well sourced. They also offer some refreshingly different views on subjects.
http://www.nationalnewswatch.com/,HIGH,Left-Center Bias,National Newswatch is a Canadian news service that primary aggregates news content from other sources. Most news content is from left-center sources such as the CBC and the Globe and Mail. National Newswatch also has an opinion page that publishes opinion pieces from other Canadian media outlets. Again; these typically come from left-center sources. We rate National Newswatch left-center for reporting bias and factual based on the sources the link to.
http://www.nationalobserver.com/,HIGH,Left-Center Bias,National Observer is a Canadian online website focused on news through the lens of energy; environment; and federal politics. The publication emphasizes quality investigations; federal politics; breaking news; opinion; and analysis. The National Observer has a left wing political bias as it relates to environmental positionsand liberal policy. National Observer is well sourced and factual in reporting. (4/27/2017)
http://www.resourcegovernance.org/,HIGH,Left-Center Bias,Monitors economic reconstruction in the country; focusing on the oil industry; to ensure it is managed responsibly.
http://www.nbcnews.com/,HIGH,Left-Center Bias,NBC News is considered a mainstream media source. NBC News is a division of the American broadcast network NBC. The division operates under NBCUniversal News Group; a subsidiary of NBC Universal; all owned by Comcast. Has a left-center bias in reporting and story choices. NBC News is well sourced and factual.
http://www.ncpolicywatch.com/,HIGH,Left-Center Bias,NC Policy Watch is a North Carolina public-policy think tank co-founded by Chris Fitzsimon and the A.J. Fletcher Foundation.The organization works in numerous public policy fields including issues of poverty; health care; mental health issues; transportation; and tax reform. NC Policy Watch has moderate left-center bias in reporting as they support mostly progressive causes. All information is well sourced and factual. (2/14/2017)
http://www.news.com.au/,HIGH,Left-Center Bias,News.com.au is an Australian news and entertainment website owned by News Corp Australia. It specializes in breaking national and international news as well as entertainment; sport; lifestyle; travel; technology and finance. News.com.au has a left-center bias though story selection and political editorial bias. They are well sourced and factual. (2/14/2017)
http://www.newsday.com/,HIGH,Left-Center Bias,Newsday is an American daily newspaper that primarily serves Nassau and Suffolk counties and the New York City borough of Queens on Long Island; although it is sold throughout the New York metropolitan area. Newsday has a left wing editorial bias; but reports with crediblesourcing.
https://newsone.com/,HIGH,Left-Center Bias,NewsOne is a news and opinion website that focuses on news about Blacks in America. NewsOne has a moderate left wing bias in wording and story choices; but balance this with well sourced factual reporting.
http://www.newsweek.com/,HIGH,Left-Center Bias,Newsweek is an American weekly news magazine founded in 1933. Over the last few years its content has shifted more to the left. If this trend continues this source may move to Left bias.
http://www.newsy.com/,HIGH,Left-Center Bias,Newsy is a video news network that produces short-form video news pieces that provide breaking news and updates across U.S. and world news; policy and politics; science and health; entertainment; technology; business and sports.
https://newleftreview.org/,HIGH,Left-Center Bias,The New Left Review is a bimonthly political academic journal covering world politics; economy; and culture which was established in 1960. In 2003; the magazine ranked 12th by impact factor on a list of the top 20 political science journals in the world. Has very high standards of journalism with a moderate left bias in reporting.
https://newmatilda.com/,HIGH,Left-Center Bias,Newmatilda.com; commonly known as New Matilda; is a left-wing independent Australian website of news; analysis and satire.
https://newmoderate.com/,HIGH,Left-Center Bias,Although this source claims to be centrist; most of the wording and reporting has a slight left of center of bias. (9/4/2016)
http://www.nydailynews.com/,MIXED,Left-Center Bias,The New York Daily News is an American newspaper based in New York City. It is the fourth-most widely circulated daily newspaper in the United States.It was founded in 1919; and was the first U.S. daily printed intabloid format. Publishes news with sensational headlines that do not always match the story. (5/18/2016) Updated (1/12/2017)
https://www.newsandgutsmedia.com/,HIGH,Left-Center Bias,News and Guts is an independent media company founded by long time news journalist Dan Rather. The website features writings by Dan Rather that is well sourced and well written. Has a left-center political bias in reporting only.
http://www.npr.org/sections/news/,HIGH,Left-Center Bias,National Public Radiousually shortened to NPR;is an American privately and publicly funded non-profit membership media organization that serves as a national syndicator to a network of 900 public radio stations in the United States of America. Verycentrist in reporting. Very factual. Has a liberal editorial bias.
https://www.nytimes.com/,HIGH,Left-Center Bias,The New York Times (sometimes abbreviated to NYT) is an American daily newspaper; founded and continuously published in New York City since September 18; 1851; by The New York Times Company. The New York Times has won 117 Pulitzer Prizes; more than any other news organization. NYT is well sourced and factual in reporting. The paper has a pretty strong left wing editorial bias; but is considered one of the most reliable sources for information. (5/18/2016) Update (4/25/2017)
http://www.oilandwaterdontmix.org/,HIGH,Left-Center Bias,Oil and Water Dont Mix is anumber of organizations and citizens across Michigan who are working to keep oil out of the Great Lakes. Reports factually on the situation of pipelines that effect the lake. Has a left-center environmental bias in reporting.
https://www.opendemocracy.net/,HIGH,Left-Center Bias,openDemocracy is an independent global media platform covering world affairs; ideas and culture which seeks to challenge power and encourage democratic debate across the world. openDemocracy was founded in 2000 by Anthony Barnett; David Hayes; Susan Richards and Paul Hilder. Publishing started in May 2001. Prominent contributors have included Kofi Annan; George Soros; Ayaan Hirsi Ali; Shirin Ebadi; Sidney Blumenthal; Peter Hain; Pierre Bourdieu; Manuel Castells; Fred Halliday; and David Blunkett. openDemocracys mission statement asserts: openDemocracy is committed to human rights and democracy. We aim to ensure that marginalised views and voices are heard. We believe facilitating argument and understanding across geographical boundaries is vital to preventing injustice. openDemocracy has a left bias in reporting and political affiliation; however all articles are well sourced and evidence based. The evidence based reporting helps balance the progressive bias and therefore we rate this source Left-Center. Special note: some articles do swing far left; but others are balanced so one must judge on a per article basis. (3/23/2017)
http://www.opposingviews.com/,HIGH,Left-Center Bias,Opposing Views (also known as OV) is an American digital news website headquartered in Los Angeles.The site presents original and aggregated news articles from across the political spectrum. Through our article sampling there were more articles that leaned left based on reporting choices and wording. All information is sourced.
http://www.ozy.com/,HIGH,Left-Center Bias,OZY Media is an international online magazine that focuses on news; arts; culture; politics; business and sports. OZY was launched in September 2013 by former MSNBC news anchor; journalist; and businessman Carlos Watson. Ozy produces well sourced content that is factually based with a left-center bias in report choices and wording. (1/20/2017)
https://panampost.com/,HIGH,Left-Center Bias,The PanAm Post is an American news and analysis websitethat specializes in international subjects as well as topics in the Americas. The website focuses on multilingual and international content in order to follow the tradition of Pan-Americanism. It was founded in 2013 and its headquarters is in Miami; Florida. (8/18/2016)
http://www.pbs.org/newshour/,HIGH,Left-Center Bias,The PBS NewsHour is an American daily evening television news program that is broadcast on the Public Broadcasting Service (PBS); airing seven nights a week on more than 300 of the public broadcasters member stations. As the nations first hour-long nightly news broadcast; the program is known for its in-depth coverage of issues and current events. PBS produces high quality journalism that is sourced and factual. They have a left-center bias in reporting. (5/18/2016)
http://www.philly.com/inquirer/,HIGH,Left-Center Bias,The Philadelphia Inquirer is a morning daily newspaper that serves the Philadelphia; metropolitan area of the United States. Is factual in reporting; with a left-center editorial bias.
https://www.inquirer.net/,HIGH,Left-Center Bias,The Philippine Daily Inquirer; popularly known as the Inquirer; is the most widely read broadsheet newspaper in the Philippines; with a daily circulation of 260;000 copies. The Philippine Daily Inquirer reports international news with minimal bias and is factually sourced. Has left of center editorial bias. (11/25/2016)
http://www.post-gazette.com/,HIGH,Left-Center Bias,Daily newspaper from Pittsburgh; Pennsylvania. The Pittsburgh Post-Gazette is factual in reporting with a left-center editorial bias. (7/30/2016)
http://politicalcritique.org/,High,Left-Center Bias,Krytyka Polityczna (Political Critique) is the largest Central and Eastern European liberal network of institutions and activists. Has a left of center political bias; but reports with sourcing and evidence.
http://www.politico.com/,HIGH,Left-Center Bias,Politico is an American political-journalism organization based in Arlington County; Virginia; that covers politics and policy in the United States and internationally. It distributes content via television; the Internet; The Politico newspaper; radio; and podcasts. Its coverage in Washington; D.C.; includes the U.S. Congress; lobbying; media and the presidency. Has a left-center bias in reporting.
http://politicsthatwork.com/,HIGH,Left-Center Bias,Politics That Work is a website dedicated to providing statistical evidence on political issues such as crime; guns and economy. While we find the information to be credible and accurate; we also find it to be one sided in an attempt to show that Democratic policy is superior. Politics That Works also aggregates news from left and left-center sources. Based on presenting factual information that favors the left we rate this source Left-Center biased.
http://www.pressherald.com/,HIGH,Left-Center Bias,The Portland Press Herald (and Maine Sunday Telegram; collectively known as The Portland Newspapers) publish daily newspapers in the city of Portland; Maine; in the United States . Factual reporting with a left-center editorial bias.
http://www.presstv.com/,MIXED,Left-Center Bias,Press TV is a 24-hour English language news and documentary network; affiliated with Islamic Republic of Iran Broadcasting (IRIB). IRIB is state-owned but independent of the Iranian government in its management; and is the only legal TV and radio broadcaster inside Iran. Has a strong Iranian nationalism in reporting. However; when reporting USA new it has a Left-Center political bias. (5/18/2016)
https://www.propublica.org/,HIGH,Left-Center Bias,ProPublica is a non-profit corporation based in New York City. It describes itself as an independent non-profit newsroom that produces investigative journalism in the public interest.In 2010 it became the first online news source to win a Pulitzer Prize. Propublica is a highly evidence based source with in-depth investigative journalism. Hasa left-center political bias in story selection and occasionally with wording.(10/23/2016)
http://www.prospectmagazine.co.uk/,HIGH,Left-Center Bias,Prospect is a monthly British general interest magazine; specializing in politics; economics and current affairs. It features a mixture of lengthy analytic articles; first-person reportage; one-page columns; and shorter; quirky items. Well sourced journalism with a left-center bias in reporting.
http://www.providencejournal.com/,HIGH,Left-Center Bias,Daily newspaper from Providence; Rhode Island. Factual reporting with a left-center editorial bias. (7/30/2016)
http://www.pri.org/,High,Left-Center Bias,Public Radio International (PRI) is a Minneapolis-based American public radio organization; with locations in Boston; New York; London and Beijing.PRI is a media content creator and also distributes programs from many sources; competing with National Public Radio; American Public Media and the Public Radio Exchange to provide programming to public radio stations. This is a strong evidence based source with a left-center bias in reporting and story selection.
http://putintrump.org/,HIGH,Left-Center Bias,PutinTrump.org aggregates news about USA-Russia relations as it relates to Trump and Putin. They aggregate news from a wide variety of sources with most from our Left-Center bias category and some from Least Biased. Editorially there is a clear left bias against Trump.
http://qz.com/,HIGH,Left-Center Bias,Quartz (qz.com) is a digital global business news publication.It is owned by Atlantic Media Co.; the publisher of The Atlantic; National Journal; and Government Executive. Quartz targets high-earning readerswho traditionally read other left-leaning publications.
http://www.rfa.org/english/,HIGH,Left-Center Bias,Radio Free Asia (RFA) is a private; nonprofit international broadcasting agency of the United States governmentthat broadcasts and publishes online news; information; and commentary to listeners in East Asia while advancing the goals of U.S. foreign policy. RFA is funded by the Broadcasting Board of Governors (BBG); an independent agency of the United States governmentresponsible for all non-military; international broadcasting sponsored by the U.S government (such as Radio Free Europe); which appoints the board of RFA. RFA distributes content in nine Asian languages for audiences in six countries. RFA is well sourced and factual in reporting. Has very slight left leaning bias in reporting choices. (11/28/2016)
http://www.newsobserver.com/,HIGH,Left-Center Bias,The News & Observer is a regional daily newspaper that serves the greater Triangle area based In Raleigh. The paper is the second largest in the state after The Charlotte Observer. The paper has also been awarded three Pulitzer Prizes. Has a left of center editorial bias an dis factual in reporting. (5/18/2016)
http://rationalwiki.org/wiki/Main_Page,HIGH,Left-Center Bias,The purpose of RationalWiki is:Analyzing and refuting pseudoscience and the anti-science movement; documenting the full range of crank ideas; explorations of authoritarianism and fundamentalism; analysis and criticism of how these subjects are handled in the media. RationalWiki does have a left of center bias in what they choose to list.
http://therealnews.com/t2/,HIGH,Left-Center Bias,The Real News (TRNN) is a nonprofit; viewer-supported daily video-news and documentary service. TRNN launched in 2007 by Paul Jay; who serves as the networks CEO and senior editor. TRNN describes itself as a news source focused on providing independent and uncompromising journalism. The Real News has a moderate left wing bias that is reflected in its positions on economics. It generally gives perspective from both sides; but favors more left-wing economics through whom it interviews. (5/18/2016)
